{
  "schema_version": 1,
  "engine_version": "0.1.0",
  "run_date": "2026-10-29",
  "started_at": "2026-10-29T17:00:00Z",
  "updated_at": "2026-10-29T17:00:09Z",
  "window": {
    "since": "2026-10-26T17:00:00Z",
    "until": "2026-10-29T17:00:00Z"
  },
  "options": { "sections": [], "sources": [], "offline": false },
  "sources": [
    {
      "id": "example-lab",
      "status": "ok",
      "sections": ["models"],
      "kind": "rss",
      "http_status": 200,
      "items": 3,
      "items_dropped_window": 1,
      "items_dropped_invalid": 0,
      "duration_ms": 240,
      "from_cache": false,
      "redirected_to": null,
      "note": null,
      "unread": 0
    },
    {
      "id": "example-models",
      "status": "ok",
      "sections": ["models"],
      "kind": "json-snapshot-diff",
      "http_status": 200,
      "items": 0,
      "items_dropped_window": 0,
      "items_dropped_invalid": 0,
      "duration_ms": 310,
      "from_cache": false,
      "redirected_to": null,
      "note": "baseline created",
      "unread": 0
    },
    {
      "id": "example-news",
      "status": "empty",
      "sections": ["models"],
      "kind": "sitemap",
      "http_status": 200,
      "items": 0,
      "items_dropped_window": 0,
      "items_dropped_invalid": 0,
      "duration_ms": 520,
      "from_cache": true,
      "redirected_to": "www.example.com",
      "note": null,
      "unread": 4
    },
    {
      "id": "example-releases",
      "status": "failed",
      "reason": "http_error",
      "sections": ["tooling"],
      "kind": "json",
      "http_status": 404,
      "items": 0,
      "items_dropped_window": 0,
      "items_dropped_invalid": 0,
      "duration_ms": 95,
      "from_cache": false,
      "redirected_to": null,
      "note": null,
      "unread": 0
    },
    {
      "id": "example-private",
      "status": "skipped",
      "reason": "missing_auth_env",
      "sections": ["tooling"],
      "kind": "json",
      "http_status": null,
      "items": 0,
      "items_dropped_window": 0,
      "items_dropped_invalid": 0,
      "duration_ms": 0,
      "from_cache": false,
      "redirected_to": null,
      "note": null,
      "unread": 0
    }
  ],
  "not_collected": [
    { "id": "example-mcp", "via": "mcp", "sections": ["tooling"] },
    { "id": "example-search", "via": "search", "sections": ["models"] }
  ]
}
